{"schema_version":"1.0.0","idea_id":"health_handwash_temp_001","job_id":"job_health_handwash_001","lane_id":"health","language":"ru","target_duration_seconds":27,"hook":{"spoken_text":"Горячая вода не делает мытьё рук автоматически лучше.","first_frame_text":"Горячее ≠ чище","duration_seconds":2.3},"segments":[{"segment_id":"s1","start_seconds":0,"end_seconds":5.5,"spoken_text":"Горячая вода сама по себе не делает мытьё рук эффективнее.","caption_text":"Не в температуре","visual_intent":"Крупный план ладоней под струёй воды; холодный клинический свет; пар не акцентируется, главный объект — кожа и вода.","claim_ids":["claim_temp"]},{"segment_id":"s2","start_seconds":5.5,"end_seconds":11,"spoken_text":"В исследованных условиях более горячая вода не показала значимого преимущества по удалению микроорганизмов.","caption_text":"Горячее не лучше","visual_intent":"Макро капель на пальцах и тыльной стороне кистей; ровный свет, чистый фон, медленное движение воды.","claim_ids":["claim_temp"]},{"segment_id":"s3","start_seconds":11,"end_seconds":16.5,"spoken_text":"Гораздо важнее мыло: оно снижает бактериальное загрязнение лучше, чем одна вода.","caption_text":"Мыло важнее","visual_intent":"Плотная пена между пальцами крупным планом; акцент на покрытии всех участков рук.","claim_ids":["claim_soap"]},{"segment_id":"s4","start_seconds":16.5,"end_seconds":22,"spoken_text":"CDC рекомендует намочить руки, намылить, тереть, смыть и высушить.","caption_text":"Пять шагов","visual_intent":"Последовательные крупные планы: намочить, пена, трение ладоней, смывание, полотенце; клиническая цветокоррекция.","claim_ids":["claim_steps"]},{"segment_id":"s5","start_seconds":22,"end_seconds":27,"spoken_text":"И не спешите: намыленные руки нужно тереть не менее двадцати секунд.","caption_text":"20 секунд трения","visual_intent":"Крупный план тщательного трения больших пальцев, между пальцами и кончиков; вода включается только после полного трения.","claim_ids":["claim_time"]}],"caption_style":{"max_lines":2,"max_words_per_card":4,"safe_zone":"center_lower_third","side_labels":false},"edit_direction":{"visual_world":"Крупные чистые планы рук и воды, холодный клинический цвет, главный объект крупный, без боковых служебных надписей.","music_mood":"спокойный, нейтральный, образовательный","average_cut_seconds":2.7,"speaker_scale":0.78},"disclaimer":"Материал носит образовательный характер и не заменяет медицинские рекомендации.","decision":{"passed":true,"needs_human_review":false,"review_notes":[]}}